[
  {
    "id": "sample_my_property",
    "name": "Nossa Acomodação (Referência) — Orla de Atalaia",
    "platform": "Direto",
    "url": "https://booking.com/",
    "type": "Apartamento",
    "isFavorite": false,
    "isBenchmark": false,
    "location": {
      "address": "Av. Santos Dumont, Orla de Atalaia, Aracaju - SE",
      "neighborhood": "Atalaia",
      "lat": -10.9858,
      "lng": -37.0435,
      "distanceToBeachKm": 0.1
    },
    "features": {
      "bedrooms": 2,
      "bathrooms": 2,
      "maxGuests": 6,
      "hasPool": true,
      "hasAirCond": true,
      "hasParking": true,
      "hasSeaView": true,
      "rating": 4.95,
      "reviewCount": 38
    },
    "pricing": {
      "basePrice": 340.00,
      "cleaningFee": 150.00,
      "calendar": [
        {
          "startDate": "2026-07-01",
          "endDate": "2026-07-31",
          "pricePerNight": 350.00,
          "minNights": 2,
          "isAvailable": true,
          "seasonNote": "Férias de Julho"
        },
        {
          "startDate": "2026-12-20",
          "endDate": "2027-01-05",
          "pricePerNight": 650.00,
          "minNights": 4,
          "isAvailable": true,
          "seasonNote": "Réveillon / Alta Temporada"
        }
      ]
    },
    "images": [
      "https://images.unsplash.com/photo-1522708323590-d24dbb6b0267?auto=format&fit=crop&w=800&q=80"
    ],
    "lastUpdated": "2026-07-16T16:00:00Z"
  },
  {
    "id": "benchmark_arcus_hotel",
    "name": "Arcus Hotel Aracaju by Atalaia (Benchmark 2 Quartos)",
    "platform": "Booking",
    "url": "https://www.booking.com/hotel/br/arcus-aracaju-by-atalaia.html",
    "type": "Hotel",
    "isFavorite": true,
    "isBenchmark": true,
    "location": {
      "address": "Av. Rotary, 125 - Atalaia, Aracaju - SE",
      "neighborhood": "Atalaia",
      "lat": -10.9882,
      "lng": -37.0465,
      "distanceToBeachKm": 0.15
    },
    "features": {
      "bedrooms": 2,
      "bathrooms": 2,
      "maxGuests": 4,
      "hasPool": true,
      "hasAirCond": true,
      "hasParking": true,
      "hasSeaView": true,
      "rating": 4.80,
      "reviewCount": 512
    },
    "pricing": {
      "basePrice": 680.00,
      "cleaningFee": 0.00,
      "calendar": [
        {
          "startDate": "2026-07-01",
          "endDate": "2026-07-31",
          "pricePerNight": 700.00,
          "minNights": 1,
          "isAvailable": true,
          "seasonNote": "Férias de Julho (Meta 50%: R$ 350)"
        },
        {
          "startDate": "2026-12-20",
          "endDate": "2027-01-05",
          "pricePerNight": 1300.00,
          "minNights": 3,
          "isAvailable": true,
          "seasonNote": "Réveillon / Alta Temporada (Meta 50%: R$ 650)"
        }
      ]
    },
    "images": [
      "https://images.unsplash.com/photo-1566073771259-6a8506099945?auto=format&fit=crop&w=800&q=80"
    ],
    "lastUpdated": "2026-07-16T16:00:00Z"
  },
  {
    "id": "airbnb_sample_101",
    "name": "Duplex Premium Passarela do Caranguejo com Piscina",
    "platform": "Airbnb",
    "url": "https://www.airbnb.com.br/",
    "type": "Apartamento",
    "isFavorite": true,
    "isBenchmark": false,
    "location": {
      "address": "Próximo à Passarela do Caranguejo, Atalaia, Aracaju - SE",
      "neighborhood": "Atalaia",
      "lat": -10.9920,
      "lng": -37.0450,
      "distanceToBeachKm": 0.25
    },
    "features": {
      "bedrooms": 3,
      "bathrooms": 3,
      "maxGuests": 8,
      "hasPool": true,
      "hasAirCond": true,
      "hasParking": true,
      "hasSeaView": false,
      "rating": 4.88,
      "reviewCount": 64
    },
    "pricing": {
      "basePrice": 410.00,
      "cleaningFee": 180.00,
      "calendar": [
        {
          "startDate": "2026-07-01",
          "endDate": "2026-07-31",
          "pricePerNight": 440.00,
          "minNights": 2,
          "isAvailable": false,
          "seasonNote": "Férias de Julho"
        },
        {
          "startDate": "2026-12-20",
          "endDate": "2027-01-05",
          "pricePerNight": 820.00,
          "minNights": 5,
          "isAvailable": true,
          "seasonNote": "Réveillon / Alta Temporada"
        }
      ]
    },
    "images": [
      "https://images.unsplash.com/photo-1502672260266-1c1ef2d93688?auto=format&fit=crop&w=800&q=80"
    ],
    "lastUpdated": "2026-07-16T16:00:00Z"
  },
  {
    "id": "booking_sample_202",
    "name": "Flat Compacto Orla de Atalaia (Lagos da Orla)",
    "platform": "Booking",
    "url": "https://www.booking.com/",
    "type": "Studio",
    "isFavorite": false,
    "isBenchmark": false,
    "location": {
      "address": "Região dos Lagos da Orla, Atalaia, Aracaju - SE",
      "neighborhood": "Atalaia",
      "lat": -10.9785,
      "lng": -37.0410,
      "distanceToBeachKm": 0.3
    },
    "features": {
      "bedrooms": 1,
      "bathrooms": 1,
      "maxGuests": 3,
      "hasPool": false,
      "hasAirCond": true,
      "hasParking": true,
      "hasSeaView": true,
      "rating": 4.70,
      "reviewCount": 112
    },
    "pricing": {
      "basePrice": 220.00,
      "cleaningFee": 100.00,
      "calendar": [
        {
          "startDate": "2026-07-01",
          "endDate": "2026-07-31",
          "pricePerNight": 240.00,
          "minNights": 1,
          "isAvailable": true,
          "seasonNote": "Férias de Julho"
        },
        {
          "startDate": "2026-12-20",
          "endDate": "2027-01-05",
          "pricePerNight": 480.00,
          "minNights": 3,
          "isAvailable": true,
          "seasonNote": "Réveillon / Alta Temporada"
        }
      ]
    },
    "images": [
      "https://images.unsplash.com/photo-1560448204-e02f11c3d0e2?auto=format&fit=crop&w=800&q=80"
    ],
    "lastUpdated": "2026-07-16T16:00:00Z"
  }
]
